<?xml version="1.0" encoding="UTF-8"?>

<!DOCTYPE students SYSTEM "index.dtd" [

]>


<students>
    <name>
        <first_name></first_name>
        <last_name></last_name>
    </name>
    <age>19</age>
    <email>hamzaanis2014@gmail.com &writer;</email>
    <email>hamza@domain.com</email>
    <id>3</id>
    <address home="home address" office="office address">f 26 block f</address>
</students>
